date,username,to,replies,retweets,favorites,text,geo,mentions,hashtags,id,permalink
2009-02-04 17:06:38,douance_quebec,,0,0,0,"H1N1 résistant au vaccin à Taïwan augmente les préoccupations [trad Niman] http://tinyurl.com/cbz79b",,,,1176850632,https://twitter.com/douance_quebec/status/1176850632
2009-02-04 14:18:05,pofeng,,0,0,0,"H1N1對於治療流感的克流感藥物，出現高達百分之百的抗藥性 http://tinyurl.com/cs39tj",,,,1176328000,https://twitter.com/pofeng/status/1176328000
2009-02-04 03:38:21,latimesscience,,0,0,0,"Tamiflu no longer works for dominant flu strain: U.S. health officials say almost 100% of the type A H1N1 strain.. http://bit.ly/16mHu",,,,1175204127,https://twitter.com/latimesscience/status/1175204127
2009-02-03 20:37:43,gelberschleim,,0,0,0,"GRIPPE: @CedricFontaine Oui! Anyway, on frôle 100% de résistance au Tamiflu ds H1N1 (grippe saisonnière) .. http://tinyurl.com/afeswy",,@CedricFontaine,,1174099157,https://twitter.com/gelberschleim/status/1174099157
2009-02-03 20:25:51,douance_quebec,CedricFontaine,0,0,0,"@CedricFontaine Oui! Anyway, on frôle 100% de résistance au Tamiflu ds H1N1 (grippe saisonnière) worldwide. C'est le même N1 que dans H5N1!",,@CedricFontaine,,1174065485,https://twitter.com/douance_quebec/status/1174065485
2009-02-03 17:48:26,ChirpLouder,,0,0,0,"Concern: Asia's use of prophylactic Tamiflu amid Tamiflu-resistant seasonal H1N1. Dual H1N1-H5N1 infect. might cause Tamiflu-resistant H5N1.",,,,1173599779,https://twitter.com/ChirpLouder/status/1173599779
2009-02-03 00:43:39,douance_quebec,,0,0,0,"Du H1N1 résistant au vaccin au Japon soulève des préoccupations [trad Niman] http://tinyurl.com/adr927",,,,1171519010,https://twitter.com/douance_quebec/status/1171519010
2009-02-02 20:15:32,douance_quebec,,0,0,0,"Du H1N1 résistant au Tamiflu explose au Japon [trad Niman] http://tinyurl.com/cyuvqx",,,,1170845709,https://twitter.com/douance_quebec/status/1170845709
2009-02-02 15:53:25,douance_quebec,cyberlou33,0,0,0,"@cyberlou33 Résistance au Tamiflu frôle maintenant 100% dans H1N1 grippe saisonnière. Cela pourrait remettre en question stocks antiviraux.",,@cyberlou33,,1170108866,https://twitter.com/douance_quebec/status/1170108866
2009-02-01 17:11:58,drnic1,,0,0,0,"Current flu strain h1n1 is resistant to Tamiflu",,,,1167207558,https://twitter.com/drnic1/status/1167207558
2009-01-30 21:10:13,douance_quebec,,0,0,0,"Du H1N1 résistant au vaccin et au Tamiflu en Corée? [trad Niman] http://tinyurl.com/bv9sh4",,,,1162861226,https://twitter.com/douance_quebec/status/1162861226
2009-01-30 21:09:51,douance_quebec,,0,0,0,"Résistance au vaccin et au Tamiflu dans le H1N1, en Italie [trad Niman] http://tinyurl.com/bah5ru",,,,1162860190,https://twitter.com/douance_quebec/status/1162860190
2009-01-30 08:14:19,EarlyStageTech,,0,0,0,"Solomon Island and New Caledonia H1N1, along with Brisbane H3N2, causing some havoc here in Europe...",,,,1161111044,https://twitter.com/EarlyStageTech/status/1161111044
2009-01-28 19:29:48,FluTrackers,,0,0,0,"Dr. Cox - Oseltamivir has lost much effectiveness in treatment of H1N1 flu virus. Implications for pandemic strain? #planfirst",,,#planfirst,1156195165,https://twitter.com/FluTrackers/status/1156195165
2009-01-22 22:13:05,aafp,,0,0,0,"CDC Interim Guidance Responds to Growing Oseltamivir Resistance in Influenza A (H1N1) : The AAFP has adopted CDC.. http://tinyurl.com/ceuolj",,,,1140335356,https://twitter.com/aafp/status/1140335356
2009-01-22 03:35:07,douance_quebec,,0,0,0,"#panflu Corée: Niveaux élevés résistance Tamiflu H1N1 persistent [Niman] http://tinyurl.com/cd9hra",,,#panflu,1138161777,https://twitter.com/douance_quebec/status/1138161777
2009-01-21 14:22:30,douance_quebec,,0,0,0,"#panflu Chine: Résistance Tamiflu H1N1 soulève préoccupations [trad Niman] http://tinyurl.com/83v6tb",,,#panflu,1136281607,https://twitter.com/douance_quebec/status/1136281607
2009-01-17 14:39:07,douance_quebec,,0,0,0,"La résistance au Tamiflu dans le H1N1 se propage à travers le Japon [Niman] http://tinyurl.com/7fdhos",,,,1126189728,https://twitter.com/douance_quebec/status/1126189728
2009-01-16 23:01:53,JapanNewsFeeds,,0,0,0,"Aソ連型の97％がタミフル耐性＝今冬流行の3分の1−日本へ本格上陸・厚労省（時事通信） - Yahoo!ニュース 厚生労働省は16日、今冬流行しているインフルエンザウイルスを国立感染症研究所が調べた結果、11都道府県で採取したAソ連型ウイルス（H1N1）35株のうち ...",,,,1124948907,https://twitter.com/JapanNewsFeeds/status/1124948907
2009-01-16 22:02:03,JapanNewsFeeds,,0,0,0,"Aソ連型の97％がタミフル耐性＝今冬流行の3分の1−日本へ本格上陸・厚労省（時事通信） - Yahoo!ニュース 厚生労働省は16日、今冬流行しているインフルエンザウイルスを国立感染症研究所が調べた結果、11都道府県で採取したAソ連型ウイルス（H1N1）35株のうち ...",,,,1124822347,https://twitter.com/JapanNewsFeeds/status/1124822347
2009-01-16 21:02:03,JapanNewsFeeds,,0,0,0,"Aソ連型の97％がタミフル耐性＝今冬流行の3分の1−日本へ本格上陸・厚労省（時事通信） - Yahoo!ニュース 厚生労働省は16日、今冬流行しているインフルエンザウイルスを国立感染症研究所が調べた結果、11都道府県で採取したAソ連型ウイルス（H1N1）35株のうち ...",,,,1124703512,https://twitter.com/JapanNewsFeeds/status/1124703512
2009-01-16 20:27:18,douance_quebec,,0,0,0,"La résistance au Tamiflu dans le H1N1 se propage à travers l'Europe [Niman] http://tinyurl.com/9oj2wz",,,,1124615539,https://twitter.com/douance_quebec/status/1124615539
2009-01-16 20:02:07,JapanNewsFeeds,,0,0,0,"Aソ連型の97％がタミフル耐性＝今冬流行の3分の1−日本へ本格上陸・厚労省（時事通信） - Yahoo!ニュース 厚生労働省は16日、今冬流行しているインフルエンザウイルスを国立感染症研究所が調べた結果、11都道府県で採取したAソ連型ウイルス（H1N1）35株のうち ...",,,,1124550248,https://twitter.com/JapanNewsFeeds/status/1124550248
2009-01-16 18:02:04,JapanNewsFeeds,,0,0,0,"Aソ連型の97％がタミフル耐性＝今冬流行の3分の1−日本へ本格上陸・厚労省（時事通信） - Yahoo!ニュース 厚生労働省は16日、今冬流行しているインフルエンザウイルスを国立感染症研究所が調べた結果、11都道府県で採取したAソ連型ウイルス（H1N1）35株のうち ...",,,,1124281906,https://twitter.com/JapanNewsFeeds/status/1124281906
2009-01-14 19:54:30,ChirpLouder,,0,0,0,"Virologist with more on H1N1's Tamiflu resistance. http://bit.ly/pk7W Also see Dr. Henry Niman http://bit.ly/dmRE and http://bit.ly/1dVfKj.",,,,1119114958,https://twitter.com/ChirpLouder/status/1119114958
2009-01-10 21:37:53,ChirpLouder,,0,0,0,"Tamiflu resistance is to flu subtype H1N1, dominant in U.S. now. (NYT: http://bit.ly/3YUXGz) Unknown effect on any H5N1 pandemic.",,,,1109743462,https://twitter.com/ChirpLouder/status/1109743462
2009-01-10 21:27:08,ChirpLouder,,0,0,0,"Almost all U.S. flu (H1N1) resistant to main antiviral Tamiflu. http://bit.ly/3YUXGz Dr. Henry Niman's warned of this. http://bit.ly/dmRE",,,,1109725671,https://twitter.com/ChirpLouder/status/1109725671
2009-01-09 17:44:17,AChrisTurner,,0,0,0,"Concerned w/ H1N1 and H5N1 combining and destroying the world! The medicine we use now wont work. What will you do with an immune bird flu?",,,,1107225908,https://twitter.com/AChrisTurner/status/1107225908
2009-01-09 14:45:52,ClanMacMoore,,0,0,0,"H1N1 + H1N5 = Trouble...",,,,1106815469,https://twitter.com/ClanMacMoore/status/1106815469
2009-01-09 13:19:38,HosmerAngel,,0,0,0,"So if H5N1 flu crosses with H1N1, it will be resistant to the Tamiflu we have stockpiled and we'll all be screwed? http://tr.im/3exr",,,,1106662715,https://twitter.com/HosmerAngel/status/1106662715
2009-01-09 02:11:36,HoustonChron,,0,0,0,"Tamiflu-resistant strain found in Houston children: Physicians are concerned because the H1N1 strain has develop.. http://tinyurl.com/8pbxkg",,,,1105793062,https://twitter.com/HoustonChron/status/1105793062
2009-01-08 23:55:12,EpicBear,girlscientist,0,0,0,"@girlscientist however, it is interesting that this new H1N1 strain is not resistant to and older drug, rimantadine.",,@girlscientist,,1105565831,https://twitter.com/EpicBear/status/1105565831
2009-01-08 04:00:43,douance_quebec,,0,0,0,"La résistance au Tamiflu dans le H1N1 en Angleterre frôle 100% [Niman] http://tinyurl.com/9q742x",,,,1103608379,https://twitter.com/douance_quebec/status/1103608379
2009-01-06 14:52:40,HealthcareToday,,0,0,0,"Deadly 'superflu' hits Britain: Scientists have said a drug-resistant form of flu, the H1N1 virus, is circulatin.. http://tinyurl.com/79ppnn",,,,1099561412,https://twitter.com/HealthcareToday/status/1099561412
2009-01-05 16:15:02,douance_quebec,,0,0,0,"Hong Kong H1N1 With Tamflu and Adamantane Resistance [Niman] http://tinyurl.com/6uzeft",,,,1097368562,https://twitter.com/douance_quebec/status/1097368562
2009-01-05 00:38:22,douance_quebec,,0,0,0,"Résistance au Tamiflu répandue dans le H1N1 au Canada [Niman] http://tinyurl.com/8x6mby",,,,1096080744,https://twitter.com/douance_quebec/status/1096080744
