date,username,to,replies,retweets,favorites,text,geo,mentions,hashtags,id,permalink
2020-01-01 11:08:26,Melaniegouby,EmmanFre,0,3,0,"Vidéo difficile à regarder. Des soldats, qui semblent être avec une équipe de riposte contre #Ebola, kidnappent un enfant. Si vous avez des informations sur cette incident, DM. ",,,#Ebola,1212329729891680256,https://twitter.com/Melaniegouby/status/1212329729891680256
2020-01-01 11:08:05,ebola_youta,,0,0,0,"MORRIEさんwww",,,,1212329642910044160,https://twitter.com/ebola_youta/status/1212329642910044160
2020-01-01 11:05:32,Melaniegouby,EmmanFre,0,6,1,"This is really hard to watch. Soldiers, who seem to be with and #Ebola response team, kidnap a baby from his/her mother in #DRC. Anyone who has more information, contact Emmanuel.",,,#Ebola #DRC,1212329002121211909,https://twitter.com/Melaniegouby/status/1212329002121211909
2020-01-01 11:02:44,50sDiner1,,0,0,0,"The Ebola and the MMR- vaccine are both man- made. Ebola was never to be found outside Asia, now transported to Japan. From there this man-made virus will spread all over the world trough the O.S. Measles... https://www.facebook.com/100003075518412/posts/2541728362606323/",,,,1212328296773541889,https://twitter.com/50sDiner1/status/1212328296773541889
2020-01-01 11:02:24,Nullios1,Dragonogon,0,0,0,"omg yeah ebola-chan",,,,1212328214388969472,https://twitter.com/Nullios1/status/1212328214388969472
2020-01-01 11:00:35,DworaczekBendom,,0,0,0,"Lutte contre Ebola : faible engagement en milieu universitaire de Butembo https://dworaczek-bendome.org/v2/2020/01/01/lutte-contre-ebola-faible-engagement-en-milieu-universitaire-de-butembo/",,,,1212327754970124289,https://twitter.com/DworaczekBendom/status/1212327754970124289
2020-01-01 11:00:00,DFID_UK,,5,17,52,"UK aid has helped millions of people around the world in 2019 - from tackling Ebola in the Democratic Republic of the Congo to treating children with measles in Samoa. #UKaid #aidworks https://www.gov.uk/government/news/british-medics-in-samoa-among-the-humanitarian-heroes-of-2019",,,#UKaid #aidworks,1212327609125617666,https://twitter.com/DFID_UK/status/1212327609125617666
2020-01-01 10:57:00,forwardRPM,,0,7,20,"""Ricordo Augustine, quattro anni, sopravvissuta a ebola. È stata coraggiosa perché ha visto morire metà dei pazienti che erano lì nel centro, ma faceva un sorriso e cercava di rimanere forte"". L'esperienza di @MSF_ITALIA in Congo tra paura e coraggio.",,@MSF_ITALIA,,1212326852506923008,https://twitter.com/forwardRPM/status/1212326852506923008
2020-01-01 10:56:58,MUKALENGM,EricMpoyo,0,1,3,"Ebola mérite, en effet, une forte mobilisation ",,,,1212326843862437889,https://twitter.com/MUKALENGM/status/1212326843862437889
2020-01-01 10:56:01,mokayah,WehliyeMohamed,0,1,0,"Jubilee Party is Ebola. ",,,,1212326605860810758,https://twitter.com/mokayah/status/1212326605860810758
2020-01-01 10:54:39,wumi_kareem,Zaddy_nomso,1,2,2,"Boko haram attacks and Ebola crisis",,,,1212326260677971968,https://twitter.com/wumi_kareem/status/1212326260677971968
2020-01-01 10:53:59,Wunderwaffel501,Snowgeh,0,0,0,"Du darfst jetzt würfeln,1 und 2 ist ebola,3 und 4 ist aids und 5 und 6 ist Krebs",,,,1212326094680023040,https://twitter.com/Wunderwaffel501/status/1212326094680023040
2020-01-01 10:48:48,WikiPageBot,,0,0,0,"Prevention of viral hemorrhagic fever is similar for the different viruses. There are a number of different viral hemorrhagic fevers including Ebola virus disease, Lassa fever, Rift valley fever, Marburg virus disease, Crimean-Congo haemorrhagic fever... https://en.wikipedia.org/wiki/Prevention_of_viral_hemorrhagic_fever",,,,1212324790532550656,https://twitter.com/WikiPageBot/status/1212324790532550656
2020-01-01 10:48:08,Afropages,,0,0,0,"Radio Okapi - Lutte contre Ebola : faible engagement en milieu universitaire de Butembo http://tinyurl.com/qtllxdx",,,,1212324624077340678,https://twitter.com/Afropages/status/1212324624077340678
2020-01-01 10:44:59,BobGhosn,ecapobianco,0,0,3,"Kudos @ecapobianco Heroes of #Ebola response are @crrdc1 #volunteers who are fighting this terribla disease, every day in, even on #NewYearsEve I believe we #humanitarians should be careful in assessing success but wholeheartedly agree: #2020 should be the end of Ebola in #DRC",,@ecapobianco @crrdc1,#Ebola #volunteers #NewYearsEve #humanitarians #DRC,1212323828208209920,https://twitter.com/BobGhosn/status/1212323828208209920
2020-01-01 10:43:40,lulamae69,Chocobo_sage,1,0,3,"No one else comes close - even more of the world knows him than even Messi (saw a thing on the ebola epidemic in Africa and the nurses were doing his pose). And he was also pretty good at running...",,,,1212323497021726728,https://twitter.com/lulamae69/status/1212323497021726728
2020-01-01 10:34:58,COREIMpodcast,,1,0,6,"6/ 2014: The most widespread Ebola outbreak recorded in history occurs.",,,,1212321307909656577,https://twitter.com/COREIMpodcast/status/1212321307909656577
2020-01-01 10:22:11,DieuWedi1,JuniorNsenda2,1,0,0,"Mais, curieusement ts les prophetes de malheur qui faisaient des bruits et accusaient le President FT ne parlent meme pas qu'Ebola est vaincu. Il y a vraiment des sorciers ds notre pays. Des gens qui se rejouissent des nos malheurs p.c.q cela leur permet de s'attaquer au Pdt FT",,,,1212318092052848640,https://twitter.com/DieuWedi1/status/1212318092052848640
2020-01-01 10:19:39,GAnderluh,,0,0,5,"Leto 2019 se je zaključilo. Srečno 2020! Moj izbor leta 2019: 1. Slika črne luknje 2. Alarmantno izumiranje vrst (poročilo IPBES) 3. Googlovo kvantno računanje 4. Cepivo proti virusu ebola 5. Paleontološki dosežki (Homo luzonensis, Australopithecus anamensis,...)",,,,1212317452073340928,https://twitter.com/GAnderluh/status/1212317452073340928
2020-01-01 10:15:56,oyebosunday,Kempez2017,1,0,24,"Kills more than Ebola",,,,1212316520048726018,https://twitter.com/oyebosunday/status/1212316520048726018
2020-01-01 10:15:38,elietuseku,EbolaKoma,0,1,2,"Effectivement l année de l Action decretée par le chef de l etat. N epargnera pas Ebola. Merci #Fatshi_capitaine du peuple Congolais et l experimenter @MTamfum Dr. Muyembe",,@MTamfum,#Fatshi_capitaine,1212316442584068101,https://twitter.com/elietuseku/status/1212316442584068101
2020-01-01 10:15:26,koleosoibukun,,1,0,0,"That’s how one pastor too said Ebola was a response from God to man’s sins",,,,1212316391065477120,https://twitter.com/koleosoibukun/status/1212316391065477120
2020-01-01 10:15:16,henggee77,,0,0,0,"An Ebola patient treated in the U.S. chose to remain anonymous. Now he’s telling his story. ",,,,1212316350594482176,https://twitter.com/henggee77/status/1212316350594482176
2020-01-01 10:13:29,elietuseku,DieuWedi1,0,1,1,"Effectively cher @DieuWedi1 l année de l Action decreter par le chef de l etat. N epargnera pas Ebola. Merci #Fatshi_capitaine du peuple Congolais à l experimenter @MTamfum Dr. Muyembe",,@DieuWedi1 @MTamfum,#Fatshi_capitaine,1212315902416474112,https://twitter.com/elietuseku/status/1212315902416474112
2020-01-01 10:13:09,TomthunkitsMind,,0,1,2,"The world’ first Ebola vaccine has been approved by the World Health Organization ",,,,1212315820401012737,https://twitter.com/TomthunkitsMind/status/1212315820401012737
2020-01-01 10:12:00,MichaelMaley7,AusIndiMedia,0,0,2,"It's a bit unfair to comment too harshly on Mr Morrison's ""empathy consultant"", whose job with this government must feel a bit like that of a doctor confronted with an Ebola outbreak.",,,,1212315527307096069,https://twitter.com/MichaelMaley7/status/1212315527307096069
2020-01-01 10:10:01,iDGiam,ItsBouquet,1,0,9,"Morrison is the Ebola of the human race",,,,1212315030420512768,https://twitter.com/iDGiam/status/1212315030420512768
2020-01-01 10:06:42,jeunespatriote3,,0,0,0,"En 2019, le congolais qui m'a éblouie par son excellence est le docteur @MTamfum pour avoir trouvé la solution au problème Ebola. Voilà un exemple pour la jeunesse. Vive 2020",,@MTamfum,,1212314193405329408,https://twitter.com/jeunespatriote3/status/1212314193405329408
2020-01-01 10:04:48,DieuWedi1,EbolaKoma,3,6,16,"#RDC. Ebola sera bientot ds le passe. Merci @fatshi13 et au Dr. #Muyembe.",,@fatshi13,#RDC #Muyembe,1212313718224248832,https://twitter.com/DieuWedi1/status/1212313718224248832
2020-01-01 10:03:19,Amazng_Authors,,0,0,0,"RT@Amazng99 I wish people were as concerned about cardiovascular disease as Ebola. - Jay Cohn MD http://smarturl.it/SAVtg #health ^&amp;",,@amazng99,#health,1212313343475798016,https://twitter.com/Amazng_Authors/status/1212313343475798016
2020-01-01 10:01:22,Charliedemetro_,,0,0,0,"Ok yeah to everyone that wished me happy New Years same to yous I'm sorry I feel like I have ebola rn I'll wish everyone happy New Years tomorrow I love yous",,,,1212312853316718592,https://twitter.com/Charliedemetro_/status/1212312853316718592
2020-01-01 09:57:32,baranbedirr,,0,0,0,"The Story of Ebola https://youtu.be/XCrOde-JYs0 @YouTube aracılığıyla",,@YouTube,,1212311888052264960,https://twitter.com/baranbedirr/status/1212311888052264960
2020-01-01 09:54:59,angelicaserperi,,0,0,16,"the 2010s off the top of my head: 2010: justin bieber 2011: 1d 2012: end of the world, gangnam style 2013: miley cyrus doing the most 2014: ebola, vine, trumpets by jason derulo 2015: hello 2016: clowns, phhhoto, juju, mannequin challenge 2017: ? 2018: tide pods 2019: tiktok",,,,1212311245103091712,https://twitter.com/angelicaserperi/status/1212311245103091712
2020-01-01 09:48:31,Julius_R_Ebola,ArsonAbout,0,0,1,"I think he just doesn't like forceful people",,,,1212309619395219456,https://twitter.com/Julius_R_Ebola/status/1212309619395219456
2020-01-01 09:42:37,54321kkd,DosDonald2,1,0,2,"petit haineux lamukiste qui te dit que tu as vote Felix? ns sommes vaccines de ce genre de virus du type Ebola depuis la coordination de prof MuyembeTamfum, sorcier fifion !",,,,1212308132925341697,https://twitter.com/54321kkd/status/1212308132925341697
2020-01-01 09:41:42,fishfetish5,,0,0,0,"Ebola researchersfight",,,,1212307905107632128,https://twitter.com/fishfetish5/status/1212307905107632128
2020-01-01 09:40:31,jakz__v4,,0,1,3,"I’m lethal at bowling. Call me Ebola",,,,1212307604556460038,https://twitter.com/jakz__v4/status/1212307604556460038
2020-01-01 09:36:56,aphylante,CCastaner,0,0,3,"Contre la volonté des français, en les mutilant. Les seules réponses de ce gouvernement sont la répression, les mensonges et les tentatives désespérées de manipulation. Ce gouvernement c'est pire que le virus ebola. Que 2020 sonne votre fin de règne !",,,,1212306706077761537,https://twitter.com/aphylante/status/1212306706077761537
2020-01-01 09:34:16,AfricatimesNet,,0,0,0,"RDC: BUTEMBO VOIT DE NOUVEAUX CAS D’EBOLA https://africatimes1.net/rdc-butembo-voit-de-nouveaux-cas-debola/",,,,1212306033797926914,https://twitter.com/AfricatimesNet/status/1212306033797926914
2020-01-01 09:28:26,ebola_carambola,enot_pomozgyn,0,0,1,"",,,,1212304566366150656,https://twitter.com/ebola_carambola/status/1212304566366150656
2020-01-01 09:26:30,WrcMrs,Ryan_Champion,0,0,1,"Power Cut? Ebola?",,,,1212304079352926208,https://twitter.com/WrcMrs/status/1212304079352926208
2020-01-01 09:16:19,clubssandwich,,0,0,0,"Ebola kommt zurück und diesmal verlange ich,dass ihr jeden Menschen versucht zu retten..Ich bin so schwarz wie das schwarze meth Loch.. ",,,,1212301516339601408,https://twitter.com/clubssandwich/status/1212301516339601408
2020-01-01 09:12:40,TValdeavilla,,2,0,1,"Mahal na mahal ko tong mga tropa ko! from batang denims, Ka Ebola, Ka Putik, Hanggang sa TD!! SINCE 2***-**** ",,,,1212300597220610051,https://twitter.com/TValdeavilla/status/1212300597220610051
2020-01-01 09:10:20,Ebola_Party,libertylover64,0,0,0,"The favored candidate of the “used to be hot 15 years ago” demographic.",,,,1212300010299244544,https://twitter.com/Ebola_Party/status/1212300010299244544
2020-01-01 09:05:51,CJC_KNIGHTS,,0,0,10,"Hangover stage one “fuck I feel alright, no hangover” is complete and I’m now on hangover stage two also known as “Ebola”",,,,1212298881947643905,https://twitter.com/CJC_KNIGHTS/status/1212298881947643905
2020-01-01 09:00:20,Ebola_Party,Infantry0300,0,0,0,"Look how clean those boots are. Almost like they’ve never been worn outside before...",,,,1212297491938529286,https://twitter.com/Ebola_Party/status/1212297491938529286
2020-01-01 08:55:03,Ebola_Party,realDonaldTrump,0,0,0,"You must be very proud that the boss gave you some recognition lol",,,,1212296165150117888,https://twitter.com/Ebola_Party/status/1212296165150117888
2020-01-01 08:53:26,drraulsamayoap,teleSURtv,0,0,0,"Preocupante como un OUTBRAKE DE EBOLA ",,,,1212295757853794305,https://twitter.com/drraulsamayoap/status/1212295757853794305
2020-01-01 08:53:01,Eugenio63098874,,0,0,0,"2019 en perspectiva, ha traído varias noticias sanitarias de relevancia: hubo un segundo caso en el mundo de 'curación' del VIH, aumento del sarampión, ha habido grandes avances en varios fármacos y se ha dado el visto bueno a la vacuna contra el ébola https://amp.infosalus.com/salud-investigacion/noticia-2019-perspectiva-segundo-paciente-curado-vih-aumento-sarampion-brote-ebola-20191227110957.html",,,,1212295652195086336,https://twitter.com/Eugenio63098874/status/1212295652195086336
2020-01-01 08:50:29,MSNSouthAfrica,,0,0,0,"An Ebola patient treated in the U.S. chose to remain anonymous. Now he’s telling his story. ",,,,1212295016665583616,https://twitter.com/MSNSouthAfrica/status/1212295016665583616
2020-01-01 08:50:18,samari62011616,,0,0,0,"RITUEL VAUDOU POUR TOMBER ENCEINTE RAPIDEMENT GUERISON DES INFECTIONS : IST - GONOCOCIESIDA - EBOLA - MAITRE... : http://tinyurl.com/t66hjgh",,,,1212294970213851136,https://twitter.com/samari62011616/status/1212294970213851136
2020-01-01 08:48:55,Tonychristo2,,0,0,0,"@PlankShow to end the decade on a terrible note the 2010's had a very scary ebola hemmoragic outbreak that threaten the USA and the world! It was constantly on the news but then, all of a sudden it was like it never happened!! Happy New year, sincerely yours, Debbie Downer!",,@PlankShow,,1212294621302263808,https://twitter.com/Tonychristo2/status/1212294621302263808
2020-01-01 08:45:08,AJAyanbisi,Zaddy_nomso,2,1,5,"- Sosoliso, Dana & ADC plane crash. - Aluu 4 boys - Soka in Ibadan - Chibok girls - Otedola bridge fire accident. - Ebola virus nationwide panic - Nyanya bomb blast - Dagrin’s death - Boko Haram bombings - Fulani herdsmen killings ",,,,1212293668985589761,https://twitter.com/AJAyanbisi/status/1212293668985589761
2020-01-01 08:44:14,awawithefayries,beyer_char,0,0,2,"Frankly, I’d rather befriend Ebola. There’s an outside chance of recovering from that.",,,,1212293442241466369,https://twitter.com/awawithefayries/status/1212293442241466369
2020-01-01 08:40:44,WakeNewsRadio,,0,0,0,"Ebola wurde entwickelt: US-Regierung und Bill Gates besitzen die Patente und verwandten Impfstoffe - http://news-for-friends.de",,,,1212292560221351936,https://twitter.com/WakeNewsRadio/status/1212292560221351936
2020-01-01 08:38:09,EricMpoyo,MUKALENGM,0,0,0,"Sans vouloir verser dans une sorte de fanatisme béat, la victoire sur Ébola,que nous semblons banalis er ces jours,impose pour ses artis ans honneurs,aisances matérielles, financières au même titre que not re brave armée qui se sacrifie à l'Est. ",,,,1212291908837543937,https://twitter.com/EricMpoyo/status/1212291908837543937
2020-01-01 08:37:56,ecapobianco,,1,14,60,"2m reached with lifesaving messages on #Ebola 2m screened @health facilities 20,000 suspects &amp; victims buried in safe &amp; dignified way 2019 has been a tough but successful year for #DRC #RedCross &amp; @IFRC. Our wish for 2020 is the end of this terrible outbreak. @IFRCAfrica – at Goma, Democratic Republic of Congo",,@ifrc @IFRCAfrica,#Ebola #DRC #RedCross,1212291854311608320,https://twitter.com/ecapobianco/status/1212291854311608320
2020-01-01 08:34:09,Per56A,thomasmoller64,0,0,3,"Skottpengar? Skämt åsido, komma hit och kräva det- Ut ut ut och ut igen! Sverige behöver islam lika mycket som Afrika behöver ebola!",,,,1212290904192638977,https://twitter.com/Per56A/status/1212290904192638977
2020-01-01 08:31:05,DannyLampley,realDonaldTrump,0,0,1,"This is seriously good news that your golfing won't have to be much interrupted. Unlike with Obama - too stupid to know it is completely necessary for the President to stand at the passenger gates at our airports and personally wrestle each and every ebola virus into submission.",,,,1212290133162110978,https://twitter.com/DannyLampley/status/1212290133162110978
2020-01-01 08:30:48,wembi_steve,,7,11,47,"#RDC: 2019 était une très mauvaise année. Civils tués à BENI Crashs, naufrages, pluies, la plus longue épidémie Ebola, accidents sur la RN1, installations de la MONUSCO attaquées, 15 millions $gardés dans un coin saint, écolier tué par policier à Goma. Espérons 2020 sera mieux.",,,#RDC,1212290062769147905,https://twitter.com/wembi_steve/status/1212290062769147905
2020-01-01 08:30:05,europapress,,1,15,44,"2019 ha traído varias noticias sanitarias de relevancia: hubo un segundo caso en el mundo de 'curación' del VIH, ha habido grandes avances en varios fármacos y se ha dado el visto bueno a la vacuna contra el ébola ",,,,1212289882351120384,https://twitter.com/europapress/status/1212289882351120384
2020-01-01 08:22:59,OnShinobu,Persona_Chaos,0,0,0,"I have ebola",,,,1212288091953610752,https://twitter.com/OnShinobu/status/1212288091953610752
2020-01-01 08:12:43,HausofHilton,,10,217,623,"Patient : ""Doktor, saya ada sakit kepala dari pagi tadi. Saya google tadi. Saya rasa saya ada Ebola"". Saya : "" Kaki saya pun kejang setiap malam. Saya rasa saya mengandung"".",,,,1212285510225260544,https://twitter.com/HausofHilton/status/1212285510225260544
2020-01-01 08:07:22,Bloggasaurus,DVATW,6,3,10,"Very interesting belief. That means many things. For one, it means 'white' no- humans from America & Europe were in West Africa in 2014, helping to care for mostly black humans dying of Ebola. Where, I wonder, was THIS woman? ",,,,1212284162851430400,https://twitter.com/Bloggasaurus/status/1212284162851430400
2020-01-01 08:03:11,Nawaiwaqt_,,0,0,1,"ڈی آرکانگومیں ایبولاوباء، 3373اعلان شدہ کیسوں میں مجموعی طورپر2231افرادہلاک ہوئے https://www.nawaiwaqt.com.pk/01-Jan-2020/1098873 #DRCongo #Ebola #DeadlyDisease #Cases #People #Killed",,,#DRCongo #Ebola #DeadlyDisease #Cases #People #Killed,1212283112870350848,https://twitter.com/Nawaiwaqt_/status/1212283112870350848
2020-01-01 07:54:16,ayekhemheferdi1,,1,2,8,"Till now Madam Stella Ameyo Shade Adadevoh, the woman who saved Nigeria from Ebola crisis which would have killed millions of Nigerians, has still not be honored properly. In the history of Nigeria existence, she one of the greatest soul, gift that God deposited in this country.",,,,1212280867462270976,https://twitter.com/ayekhemheferdi1/status/1212280867462270976
2020-01-01 07:52:20,itabasseyduke,thecableng,2,0,0,"She did well and is worthy of eulogy but credit for limiting the spread of Ebola to 20people in 3states in Nigeria should go to the GEJ govt....just saying",,,,1212280381531136000,https://twitter.com/itabasseyduke/status/1212280381531136000
2020-01-01 07:37:55,thecableng,,1,9,17,"But upon treatment, it was discovered that Sawyer was not responding to medication and analgesics. Adadevoh, who knew Sawyer just flew in from #Ebola-stricken Liberia, called for caution. But the rich and powerful always fight back. https://www.thecable.ng/thecable-names-stella-adadevoh-as-nigerian-of-the-decade #NigerianOfTheDecade",,,#Ebola #NigerianOfTheDecade,1212276753533677568,https://twitter.com/thecableng/status/1212276753533677568
2020-01-01 07:34:38,VlRUS_EBOLA,Catambiana,0,0,1,"* Le llegan pichulas al DM *",,,,1212275924940574720,https://twitter.com/VlRUS_EBOLA/status/1212275924940574720
2020-01-01 07:33:00,ItzBrxndonFN,nearXfn,0,0,0,"Just found out ab Ebola..that Shid hurts.",,,,1212275515077353472,https://twitter.com/ItzBrxndonFN/status/1212275515077353472
2020-01-01 07:29:55,GabsHardy,,0,0,3,"NYE included pizza, Ragnarok, card games, Ebola shots, a mild stabbing, and most importantly, time spent with good friends. I hope yours was equally enjoyable!",,,,1212274741098287104,https://twitter.com/GabsHardy/status/1212274741098287104
2020-01-01 07:21:03,StatRdc,SocialGivingOrg,0,0,1,"#Measles outbreak is still getting less attention than #Ebola and data are not as available as for #Ebola. #Measles vaccine has been available for years. Many deaths could have been avoided.@MinSanteRDC @LongondoEteni @OMSRDCONGO @WamuHenriette @HenrietteWamu #DRC #rougeole",,@MinSanteRDC @LongondoEteni @OMSRDCONGO @WamuHenriette @HenrietteWamu,#Measles #Ebola #Ebola #Measles #DRC #rougeole,1212272509908860928,https://twitter.com/StatRdc/status/1212272509908860928
2020-01-01 07:19:02,anfragen_bt,,0,0,0,"Ebola-Hilfe und andere Virusinfektionen in Deutschland (Dr. Robby Schlund, Detlev Spangenberg, AfD) ",,,,1212271998463815681,https://twitter.com/anfragen_bt/status/1212271998463815681
2020-01-01 07:18:35,Gustavo__Olmos,diegoavalos85,2,1,4,"Un Tsunami? Las 7 plagas de Egipto, 2 bombas atómicas y el Ébola merecemos",,,,1212271888912830464,https://twitter.com/Gustavo__Olmos/status/1212271888912830464
2020-01-01 07:17:46,MyFreelance,,0,0,0,"Ebola survivor donates blood in Kansas City to help NBC freelance photographer in Nebraska https://wp.me/p7pqWk-gYe #freelancevideo",,,#freelancevideo,1212271682469191680,https://twitter.com/MyFreelance/status/1212271682469191680
2020-01-01 07:11:17,WindleBeth,WindleBeth,0,0,1,"Similar to Ebola...it was this huge thing and then suddenly they stopped reporting on it. I’m pretty sure people are still dying from it.",,,,1212270048380882949,https://twitter.com/WindleBeth/status/1212270048380882949
2020-01-01 07:10:24,the_ebinizeri,thecableng,0,0,2,"The unsung hero of the decade. #Ebola ",,,#Ebola,1212269826946846721,https://twitter.com/the_ebinizeri/status/1212269826946846721
2020-01-01 07:08:13,60andnotout1,,0,0,0,"US agency offers legal immunity to Ebola vaccine makers ",,,,1212269276914053121,https://twitter.com/60andnotout1/status/1212269276914053121
2020-01-01 07:06:42,ironorehopper,,0,0,0,"Top story: Drugs & Pharma Cos News You searched for Ebola – TopMedTalk https://www.topmedtalk.com/?s=Ebola, see more http://tweetedtimes.com/v/443?s=tnp",,,,1212268897522597889,https://twitter.com/ironorehopper/status/1212268897522597889
2020-01-01 07:06:17,NDABELNZE1,,0,2,6,"Le cardinal Ambongo aux habitants de Butembo : « le premier moyen contre Ebola, c’est notre comportement » ",,,,1212268791452884992,https://twitter.com/NDABELNZE1/status/1212268791452884992
2020-01-01 07:03:58,MuckZuckerburg,,0,0,0,"Sesame Street has been brought to you today by the letters BACK PAIN and FART and by the number EBOLA.",,,,1212268208775811074,https://twitter.com/MuckZuckerburg/status/1212268208775811074
2020-01-01 07:02:38,juancar88104735,,0,1,0,"El 20 de diciembre de 2019, Merck anunció que recibió la aprobación de la FDA para una vacuna contra el Ébola que contiene el virus conocido como virus de la estomatitis vesicular recombinante, el virus del Ébola de Zaire ( rVSV-ZEBOV ), y se comercializará con el nombre ERVEBO",,,,1212267871474266112,https://twitter.com/juancar88104735/status/1212267871474266112
2020-01-01 07:02:06,juancar88104735,,0,1,0,"Merck recibió la aprobación acelerada de la FDA de una vacuna viva contra el Ébola modificada genéticamente que según el propio prospecto de esta vacuna puede causar una nueva forma de infección de tipo Ébola, lo que resulta en inmunosupresión y posible transmisión de virus",,,,1212267738783244288,https://twitter.com/juancar88104735/status/1212267738783244288
2020-01-01 07:01:42,mona_cajun,MattySm16821000,3,9,10,"Only Every Day since 1/13/18, Hawaii Incoming Missile ""false alarm"" : ) Wealthiest Iranian, now Hawaii's richest man Pierre Omidyar was behind it -and So Much More. By Topic: eBay He named eBay after EBOLA. Fathers in IRAN: Omidyar, Val Jarrett, Pardis Sabeti (HRC Ebola Czar) ",,,,1212267638916730881,https://twitter.com/mona_cajun/status/1212267638916730881
2020-01-01 07:00:50,juancar88104735,,0,1,0,"https://cienciaysaludnatural.com/fda-aprueba-la-nueva-vacuna-contra-el-ebola-puede-contagiar-y-causar-inmunosupresion/ FDA aprueba la nueva vacuna contra el ébola puede contagiar y causar inmunosupresión",,,,1212267419986792448,https://twitter.com/juancar88104735/status/1212267419986792448
2020-01-01 07:00:13,missileyodeler,9teen80four,0,0,1,"https://www.youtube.com/watch?v=V1bFr2SWP1I the american dream, a tv, radio, phone &amp; microwave in every home that the bank owns while we can arm the children with a box of rabid ebola ferrets as an ultimate deterrent.",,,,1212267266869383168,https://twitter.com/missileyodeler/status/1212267266869383168
2020-01-01 06:55:05,gump1991,,0,0,0,"What ever happen to Ebola? Cover up? People forget about everything else going .....",,,,1212265971529981957,https://twitter.com/gump1991/status/1212265971529981957
2020-01-01 06:50:03,ebola_granola,,0,0,0,"thank you for promoting ebola growth but sadly i am not infecting your location of residence therefore the score does not change",,,,1212264706221543424,https://twitter.com/ebola_granola/status/1212264706221543424
2020-01-01 06:47:34,Robert2cs,ObservadBinario,0,0,0,"El mismo que dijo que descubrieron la cura del sida, del ébola y del cáncer. No se Rick...",,,,1212264079936675843,https://twitter.com/Robert2cs/status/1212264079936675843
2020-01-01 06:47:29,Jacob_Pinecone,HunterSquibb,1,1,7,"Mass Shootings Alabama’s new Laws The Ebola outbreak Kim Jong Un taking over No This 5 second clip was the worst part of the decade. ",,,,1212264060454154240,https://twitter.com/Jacob_Pinecone/status/1212264060454154240
